<?xml version="1.0" encoding="UTF-8"?>
<!ELEMENT items (item+)>
<!ELEMENT item (product, quantity)>
<!ELEMENT product (description, price)>
<!ELEMENT description (#PCDATA)>
<!ELEMENT price (#PCDATA)>
<!ELEMENT quantity (#PCDATA)>



